{
  "$schema": "https://schemas.repo-template.dev/product-overlay/v1/product-overlay.schema.json",
  "schemaId": "https://schemas.repo-template.dev/product-overlay/v1/product-overlay.schema.json",
  "schemaVersion": "1.0.0",
  "contractId": "repo-template/product-overlay/v1",
  "bootstrappedFromGuideVersion": "2.0.0",
  "lastAuditedAgainstGuideVersion": "2.0.0",
  "provenance": {
    "contractId": "repo-template/adoption-shell-v2",
    "templateRelease": "2.0.0",
    "templateDigest": "fe5527be73d4e652c14c423f428c66bf5c56aa1f206be159e2f566f2a9ba8c97"
  },
  "platforms": {
    "web": {
      "role": "primary",
      "priority": 1
    },
    "android": {
      "role": "secondary",
      "priority": 2
    },
    "browser-extension": {
      "role": "accessory",
      "priority": 3
    },
    "windows": {
      "role": "dormant",
      "revisitTrigger": "Evaluate desktop support upon customer demand"
    },
    "chromeos": {
      "role": "not-targeted",
      "rationale": "Covered by web PWA surface"
    }
  }
}
